{
  "$schema": "https://ainumbers.co/research/engineering-decision-schema/schemas/run-manifest.schema.json",
  "design": {
    "name": "FIXTURE-design",
    "rtl_commit": "FIXTURE-not-a-real-commit"
  },
  "environment": {
    "librelane_version": "FIXTURE-not-a-real-version",
    "openroad_version": "FIXTURE-not-a-real-version",
    "yosys_version": "FIXTURE-not-a-real-version",
    "nix_flake_lock_hash": "aaaaaaaaaaaaaaaaaaaaaaaaaaaaaaaaaaaaaaaaaaaaaaaaaaaaaaaaaaaaaaaa"
  },
  "pdk": {
    "name": "FIXTURE-pdk",
    "commit": "FIXTURE-not-a-real-commit"
  },
  "inputs": {
    "config_hash": "bbbbbbbbbbbbbbbbbbbbbbbbbbbbbbbbbbbbbbbbbbbbbbbbbbbbbbbbbbbbbbbb",
    "sdc_hash": "cccccccccccccccccccccccccccccccccccccccccccccccccccccccccccccccc"
  },
  "run_id": "RUN_FIXTURE",
  "started_at": "2026-08-28T11:42:18+00:00",
  "host": {
    "os": "FIXTURE-not-a-real-platform",
    "cpu": "FIXTURE-not-a-real-platform"
  }
}
